{
  "$schema": "https://json-schema.org/draft/2020-12/schema",
  "$id": "https://schemas.nexusos.dev/v1alpha2/personal-stack.schema.json",
  "title": "Nexus OS Personal Local Stack v1 declaration / lock file (v1alpha2)",
  "description": "The single machine-readable SOURCE OF TRUTH for a Nexus OS Personal instance. TARGET-STATE deployment contract — it describes the ONE opinionated local stack a Personal instance runs; it is NOT an executable installer and does not assert that a pullable container image exists. Personal v1 does not ask the owner to evaluate or choose architecture, infrastructure providers, databases, deployment modalities or optional topology: those are Hub-subscription capabilities and are pinned false in `spec.boundaries`. The only first-run LLM setup is an Anthropic and/or OpenAI connector token, supplied BY REFERENCE (see secret-bundle-ref). This document carries NO secret values.",
  "x-nexus-contract-version": "v1alpha2",
  "type": "object",
  "additionalProperties": false,
  "required": ["apiVersion", "kind", "metadata", "spec"],
  "properties": {
    "apiVersion": { "const": "nexus.io/v1alpha2" },
    "kind": { "const": "PersonalStack" },
    "metadata": {
      "type": "object",
      "additionalProperties": false,
      "required": ["stack_id", "instance_id", "generated_at"],
      "properties": {
        "stack_id": {
          "const": "personal-local-v1",
          "description": "Fixed stack identity. Personal v1 has exactly ONE predefined local stack; the id is pinned so an instance cannot silently declare a different topology."
        },
        "instance_id": { "$ref": "https://schemas.nexusos.dev/v1alpha1/common.defs.schema.json#/$defs/InstanceId" },
        "generated_at": { "$ref": "https://schemas.nexusos.dev/v1alpha1/common.defs.schema.json#/$defs/Timestamp" },
        "blueprint_version": { "type": "integer", "minimum": 1, "description": "Blueprint version this lock was derived from (traceability)." },
        "runtime_version": { "$ref": "https://schemas.nexusos.dev/v1alpha1/common.defs.schema.json#/$defs/SemVerRange", "description": "Runtime version constraint pinned for this stack." }
      }
    },
    "spec": {
      "type": "object",
      "additionalProperties": false,
      "required": ["edition", "modality", "operator", "managed_by", "hub", "data_region", "orchestration", "runtime", "persistence", "network", "llm", "secrets", "packs", "boundaries"],
      "properties": {
        "edition": {
          "$ref": "common.defs.schema.json#/$defs/Edition",
          "const": "personal",
          "description": "Always personal. The stack is the free single-owner edition."
        },
        "modality": {
          "$ref": "https://schemas.nexusos.dev/v1alpha1/common.defs.schema.json#/$defs/Modality",
          "const": "self_hosted",
          "description": "Always self_hosted. Local deployment if hardware permits."
        },
        "operator": { "const": "absent", "description": "Hub Operator (the remote Hub control channel / enrollment agent) is ABSENT. This is distinct from the in-process `reconciliation_operator` component that the single `runtime` service embeds (see spec.runtime.components): Personal reconciles desired vs actual state locally, with no Hub control plane." },
        "managed_by": { "const": "owner", "description": "The single owner runs everything." },
        "hub": { "const": "none", "description": "Personal has NO Hub dependency at any point." },
        "data_region": { "const": "local", "description": "Data never leaves the local instance." },
        "orchestration": { "const": "docker_compose", "description": "Single Docker Compose project. `docker compose up` stays the canonical base path." },
        "runtime": {
          "type": "object",
          "additionalProperties": false,
          "required": ["service", "components", "image", "ports", "health"],
          "properties": {
            "service": { "const": "runtime", "description": "The single Compose service running the Nexus OS Runtime/Platform." },
            "components": {
              "type": "array",
              "const": ["api", "reconciliation_operator", "console"],
              "description": "The ONE `runtime` process embeds exactly these three in-process components: the API, the local reconciliation operator (desired-vs-actual state, no Hub control channel), and the embedded Console. Personal never splits these into separate services."
            },
            "image": {
              "type": "object",
              "additionalProperties": false,
              "required": ["repository", "pin_policy", "resolved"],
              "description": "Container image coordinate. TARGET-STATE: this contract does NOT assert a pullable image exists; `resolved:false` marks a placeholder whose concrete digest is bound at release time.",
              "properties": {
                "repository": { "type": "string", "minLength": 1, "description": "Image repository (no fake pullable reference is implied)." },
                "pin_policy": { "type": "string", "enum": ["digest", "semver-tag"], "description": "v1 policy pins by immutable digest at release." },
                "digest": { "type": "string", "pattern": "^sha256:[0-9a-f]{64}$", "description": "Immutable digest; present ONLY when a real release image exists." },
                "resolved": { "type": "boolean", "description": "false = TARGET-STATE placeholder (docs/contract only), no pullable image yet." }
              }
            },
            "ports": {
              "type": "array",
              "minItems": 1,
              "maxItems": 1,
              "description": "Exactly one published port: the loopback HTTP listener bound to 127.0.0.1:8787.",
              "items": {
                "type": "object",
                "additionalProperties": false,
                "required": ["name", "container_port", "host_port", "bind_host"],
                "properties": {
                  "name": { "$ref": "https://schemas.nexusos.dev/v1alpha1/common.defs.schema.json#/$defs/Slug" },
                  "container_port": { "const": 8787, "description": "Fixed container port." },
                  "host_port": { "const": 8787, "description": "Fixed host port." },
                  "bind_host": { "const": "127.0.0.1", "description": "Loopback-only; no public inbound port." }
                }
              }
            },
            "health": {
              "type": "object",
              "additionalProperties": false,
              "required": ["liveness_path", "readiness_path"],
              "properties": {
                "liveness_path": { "type": "string", "pattern": "^/", "description": "Liveness probe (e.g. /healthz)." },
                "readiness_path": { "type": "string", "pattern": "^/", "description": "Readiness probe (e.g. /readyz)." },
                "interval_seconds": { "type": "integer", "minimum": 1 }
              }
            }
          }
        },
        "voice_sidecar": {
          "type": "object",
          "additionalProperties": false,
          "description": "Optional local voice sidecar (Voicebox, Spec M). NOT started by default; absence degrades only voice.",
          "required": ["enabled"],
          "properties": {
            "enabled": { "type": "boolean", "default": false },
            "base_url": { "type": "string", "description": "Loopback base URL when enabled." },
            "health_path": { "type": "string", "pattern": "^/" }
          }
        },
        "persistence": {
          "type": "object",
          "additionalProperties": false,
          "required": ["engine", "encryption_at_rest", "db_path", "journal_mode"],
          "properties": {
            "engine": { "const": "sqlite", "description": "Embedded SQLite. No Postgres/pgvector/qdrant/chroma in the default Personal stack." },
            "encryption_at_rest": { "const": true },
            "db_path": { "const": "/data/nexus.db", "description": "Fixed absolute path of the embedded SQLite database file on the local volume." },
            "journal_mode": { "const": "WAL", "description": "SQLite runs in WAL mode." },
            "migrations": { "type": "string", "enum": ["auto_on_start", "manual"], "description": "How schema migrations run locally." }
          }
        },
        "storage": {
          "type": "object",
          "additionalProperties": false,
          "required": ["blobs", "path"],
          "properties": {
            "blobs": { "const": "local_filesystem", "description": "Blobs/exports/artifacts on a local filesystem volume. No S3/MinIO in the default stack." },
            "path": { "const": "/data/artifacts", "description": "Fixed absolute path of the local artifact store." }
          }
        },
        "network": {
          "type": "object",
          "additionalProperties": false,
          "required": ["bind_default", "inbound_public"],
          "properties": {
            "bind_default": { "const": "127.0.0.1", "description": "Loopback-only by default." },
            "inbound_public": { "const": false, "description": "No public inbound listener in the default stack." },
            "tls": { "type": "string", "enum": ["off", "optional", "required"], "description": "TLS on the local listener; optional on loopback." }
          }
        },
        "llm": {
          "type": "object",
          "additionalProperties": false,
          "required": ["providers", "priority", "retry", "provider_fallback"],
          "description": "First-run LLM connectors. At least one of anthropic/openai MUST be configured; both MAY be. No other provider is part of the default Personal bootstrap. Keys are supplied BY REFERENCE only. Routing is deterministic (anthropic then openai), each provider request is tried exactly once and then retried exactly once on failure, and there is NO fallback to a different provider after that.",
          "properties": {
            "providers": {
              "type": "array",
              "minItems": 1,
              "maxItems": 2,
              "uniqueItems": true,
              "description": "Configured connectors. minItems 1 enforces the one-or-both rule; the item enum forbids any provider other than anthropic/openai. A provider MUST NOT appear twice (enforced additionally by the harness).",
              "items": {
                "type": "object",
                "additionalProperties": false,
                "required": ["provider", "secret_ref"],
                "properties": {
                  "provider": { "type": "string", "enum": ["anthropic", "openai"] },
                  "secret_ref": {
                    "type": "string",
                    "pattern": "^[A-Z][A-Z0-9_]*$",
                    "description": "NAME of the secret (e.g. ANTHROPIC_API_KEY / OPENAI_API_KEY). Never a value; resolved from the encrypted bundle / local vault."
                  },
                  "base_url": { "type": "string", "description": "Optional provider base URL override." }
                },
                "not": {
                  "anyOf": [
                    { "required": ["value"] },
                    { "required": ["secret"] },
                    { "required": ["plaintext"] },
                    { "required": ["api_key"] },
                    { "required": ["token"] },
                    { "required": ["key"] }
                  ]
                }
              }
            },
            "priority": {
              "type": "array",
              "const": ["anthropic", "openai"],
              "description": "Deterministic global provider preference order: anthropic then openai. The runtime selects the highest-priority CONFIGURED provider. ROUTING priority only — no model SKU, plan or purchasing is hardcoded."
            },
            "retry": {
              "type": "object",
              "additionalProperties": false,
              "required": ["max_retries"],
              "description": "Retry policy for a single provider request.",
              "properties": {
                "max_retries": { "const": 1, "description": "Exactly one retry: one initial attempt plus one retry of the SAME provider on failure, then give up." },
                "backoff": { "type": "string", "enum": ["none", "fixed", "exponential"], "description": "Optional backoff strategy for the single retry." }
              }
            },
            "provider_fallback": {
              "const": false,
              "description": "No fallback to a DIFFERENT provider after the selected provider's request (and its one retry) fails. The request fails; the runtime does not switch providers."
            }
          }
        },
        "secrets": {
          "type": "object",
          "additionalProperties": false,
          "required": ["scheme", "vault", "bundle_ref"],
          "properties": {
            "scheme": { "const": "age", "description": "age/X25519 envelope encryption for the import bundle (ADR-0005)." },
            "vault": { "const": "local", "description": "Secrets live in the Runtime local vault after import." },
            "bundle_ref": { "$ref": "secret-bundle-ref.schema.json" }
          }
        },
        "packs": {
          "type": "object",
          "additionalProperties": false,
          "required": ["public_lanes_enabled", "requires_hub_account"],
          "properties": {
            "public_lanes_enabled": { "const": true, "description": "public/community OSS lanes are available." },
            "requires_hub_account": { "const": false, "description": "public/community packs install with NO Hub account or entitlement." }
          }
        },
        "hardware": {
          "type": "object",
          "additionalProperties": false,
          "description": "Advisory hardware profiles. Local deployment proceeds if the minimum is met.",
          "properties": {
            "minimum": { "$ref": "#/$defs/HardwareProfile" },
            "recommended": { "$ref": "#/$defs/HardwareProfile" }
          }
        },
        "boundaries": {
          "type": "object",
          "additionalProperties": false,
          "description": "Personal prohibitions, pinned false by construction. Each of these is a Hub-subscription capability, never Personal (Spec N / ADR-0012).",
          "required": [
            "architecture_evaluation",
            "cloud_provider_selection",
            "deployment_modality_choice",
            "non_default_provider",
            "multi_user",
            "hub_premium_packs",
            "billing",
            "managed_fleet_ops"
          ],
          "properties": {
            "architecture_evaluation": { "const": false, "description": "Personal never evaluates alternative architecture." },
            "cloud_provider_selection": { "const": false, "description": "Personal never selects a cloud/BYOC/managed provider." },
            "deployment_modality_choice": { "const": false, "description": "No modality choice at bootstrap; always self_hosted local." },
            "non_default_provider": { "const": false, "description": "No LLM provider beyond Anthropic/OpenAI in the default bootstrap." },
            "multi_user": { "const": false, "description": "Single owner only." },
            "hub_premium_packs": { "const": false, "description": "No premium/private Hub packs." },
            "billing": { "const": false, "description": "No billing." },
            "managed_fleet_ops": { "const": false, "description": "No managed fleet operations." }
          }
        }
      }
    }
  },
  "$defs": {
    "HardwareProfile": {
      "type": "object",
      "additionalProperties": false,
      "required": ["cpu_cores", "ram_gb", "disk_gb"],
      "properties": {
        "cpu_cores": { "type": "integer", "minimum": 1 },
        "ram_gb": { "type": "number", "minimum": 0.5 },
        "disk_gb": { "type": "number", "minimum": 1 },
        "gpu": { "type": "boolean", "default": false, "description": "GPU is NOT required: the default stack uses hosted Anthropic/OpenAI inference." }
      }
    }
  }
}
